{
  "protocolVersion": "1.0",
  "contentID": "cute-animals",
  "contentType": "sticker-pack",
  "contentVersion": "3",
  "minimumClientVersion": "1.0",
  "metadataFileID": "pack-json",
  "files": [
    {"id": "pack-json", "fileName": "sticker-pack.json", "mediaType": "application/json", "byteCount": 512, "sha256": "aaaaaaaaaaaaaaaaaaaaaaaaaaaaaaaaaaaaaaaaaaaaaaaaaaaaaaaaaaaaaaaa", "role": "metadata"},
    {"id": "cat-wave-gif", "fileName": "cat-wave.gif", "mediaType": "image/gif", "byteCount": 2048, "sha256": "bbbbbbbbbbbbbbbbbbbbbbbbbbbbbbbbbbbbbbbbbbbbbbbbbbbbbbbbbbbbbbbb", "role": "sticker-media"},
    {"id": "cat-wave-params", "fileName": "cat-wave.json", "mediaType": "application/json", "byteCount": 256, "sha256": "cccccccccccccccccccccccccccccccccccccccccccccccccccccccccccccccc", "role": "sticker-parameters"}
  ]
}
